{"artifactCount":8,"artifacts":[{"artifactId":"fold-source","licenseSpdx":"MIT","mediaType":"application/vnd.fold+json","path":"input.fold","provenance":{"dependsOnArtifactIds":[],"derivation":"authored","sourceReferenceId":"oridesign-ref-fold-nofaces-candidate-v1","sourceUse":"project-authored"},"role":"source-input","sha256":"sha256:9461d95038ae21612319b828b16e55319c3a89175a487eb514ca783ea00ea513"},{"artifactId":"fixture-readme","licenseSpdx":"MIT","mediaType":"text/markdown; charset=utf-8","path":"README.md","provenance":{"dependsOnArtifactIds":[],"derivation":"authored","sourceReferenceId":"oridesign-ref-fold-nofaces-candidate-v1","sourceUse":"project-authored"},"role":"readme","sha256":"sha256:f45bde602ad6d0a711ce9df2b8a3c179dfe7d0b864f67dde5d0d6c3ab5cdd0ed"},{"artifactId":"face-evidence-index","licenseSpdx":"MIT","mediaType":"application/json","path":"face-evidence-index.json","provenance":{"dependsOnArtifactIds":["fold-source"],"derivation":"deterministically-generated","sourceReferenceId":"oridesign-ref-fold-nofaces-candidate-v1","sourceUse":"generated"},"role":"evidence-index","sha256":"sha256:84b2bec38cb70acf829de94901a87b3498e4c8e195c5e13a6e0fe351f9be50a2"},{"artifactId":"face-reconstruction-record","licenseSpdx":"MIT","mediaType":"application/json","path":"face-reconstruction-record.json","provenance":{"dependsOnArtifactIds":["fold-source"],"derivation":"deterministically-generated","sourceReferenceId":"oridesign-ref-fold-nofaces-candidate-v1","sourceUse":"generated"},"role":"reconstruction-record","sha256":"sha256:628f1c2f5116a8cba929de51f162c0e6011d2c987306cb76020ad4cd22d6df0a"},{"artifactId":"face-audit-record","licenseSpdx":"MIT","mediaType":"application/json","path":"face-audit-record.json","provenance":{"dependsOnArtifactIds":["fold-source","face-reconstruction-record"],"derivation":"deterministically-generated","sourceReferenceId":"oridesign-ref-fold-nofaces-candidate-v1","sourceUse":"generated"},"role":"audit-record","sha256":"sha256:770023c8ce7637764d8512ad08a3f5fe99de4f0457094fedfdd1ecd5afd5818c"},{"artifactId":"face-audit-evidence","licenseSpdx":"MIT","mediaType":"application/json","path":"face-audit-evidence.json","provenance":{"dependsOnArtifactIds":["fold-source","face-reconstruction-record"],"derivation":"deterministically-generated","sourceReferenceId":"oridesign-ref-fold-nofaces-candidate-v1","sourceUse":"generated"},"role":"audit-evidence","sha256":"sha256:03f7494ab15175d31e73c8a3b2be5278bfe128c62f5e679002d6d3424f0dfe5a"},{"artifactId":"face-mutation-suite","licenseSpdx":"MIT","mediaType":"application/json","path":"face-mutation-suite.json","provenance":{"dependsOnArtifactIds":[],"derivation":"authored","sourceReferenceId":"oridesign-ref-fold-nofaces-candidate-v1","sourceUse":"project-authored"},"role":"mutation-suite","sha256":"sha256:4a6b65f99fcb86d703cd289c6a31a8425c82f52c8cfff0ea769837349fa3315e"},{"artifactId":"face-mutation-result","licenseSpdx":"MIT","mediaType":"application/json","path":"face-mutation-result.json","provenance":{"dependsOnArtifactIds":["fold-source","face-reconstruction-record","face-mutation-suite"],"derivation":"deterministically-generated","sourceReferenceId":"oridesign-ref-fold-nofaces-candidate-v1","sourceUse":"generated"},"role":"mutation-result","sha256":"sha256:cd43034d08a0037239d9b4b1ffc70ebcc5e624ba3d81ca1bb68c7cedd10ee5cd"}],"canonicalManifestPath":"tests/fixtures/manifest.json","canonicalManifestRegistration":"not-registered","canonicalPromotionClaimed":false,"contractStatus":"candidate","fixtureId":"REF-FOLD-NOFACES","generator":{"auditRepetition":0,"auditSeed":42,"generatorId":"oridesign-ref-fold-nofaces-candidate-bundle","generatorVersion":"1.0.0-candidate","reconstructionRepetition":0,"reconstructionSeed":41,"serialization":"stable-json-utf8-lf-v1"},"globalM0fGate":"not-evaluated","provenance":{"authors":["OriDesign contributors"],"licenseSpdx":"MIT","redistribution":"allowed","sourceKind":"project-authored","sourceReferenceId":"oridesign-ref-fold-nofaces-candidate-v1","title":"REF-FOLD-NOFACES project-authored candidate vector"},"recordType":"m0f-ref-fold-nofaces-candidate-bundle-ledger","schemaId":"https://oridesign.local/schemas/m0f/ref-fold-nofaces-candidate-bundle-ledger-v1.schema.json","schemaVersion":1,"scientificClaim":false,"scientificVerificationClaimed":false,"scope":"project-authored-face-reconstruction-audit-and-mutation-reproducibility-only","toleranceProfileIncluded":false}
